{
  "schema_version": "2.0",
  "event_id": "00000000-0000-4000-8000-000000000001",
  "ts_start": "2026-04-25T14:00:00.000Z",
  "ts_end": "2026-04-25T14:00:00.010Z",
  "duration_ms": 10,
  "kind": "http",
  "service": "checkout",
  "env": "test",
  "trace_id": "11111111111111111111111111111111",
  "span_id": "1111111111111111",
  "parent_span_id": "",
  "status": "ok",
  "steps": [
    { "name": "db.load_cart", "start_ms": 0, "duration_ms": 4, "status": "ok" }
  ],
  "logs": [],
  "fields": { "http": { "method": "POST", "route": "/checkout", "status": 200 } },
  "errors": []
}
